{
  "$schema": "https://json-schema.org/draft/2020-12/schema",
  "title": "OpportunityBrief",
  "type": "object",
  "required": ["version", "type", "slug", "created", "created_by", "status", "score", "summary", "audience", "data_wanted", "evidence", "willingness_to_pay", "source_rights", "first_sale_path"],
  "properties": {
    "version": {"const": 1},
    "type": {"const": "opportunity_brief"},
    "slug": {"type": "string", "pattern": "^[a-z0-9][a-z0-9-]*[a-z0-9]$"},
    "created": {"type": "string", "format": "date-time"},
    "created_by": {"type": "string"},
    "status": {"enum": ["PROPOSED", "APPROVED", "REJECTED", "PURSUED", "BLOCKED", "KILLED"]},
    "score": {"type": "integer", "minimum": 1, "maximum": 10},
    "summary": {"type": "string", "minLength": 10},
    "audience": {
      "type": "object",
      "required": ["who", "where_found"],
      "properties": {
        "who": {"type": "string"},
        "where_found": {"type": "array", "items": {"type": "string"}, "minItems": 1}
      }
    },
    "data_wanted": {"type": "string"},
    "evidence": {
      "type": "array",
      "minItems": 1,
      "items": {
        "type": "object",
        "required": ["source", "url"],
        "properties": {
          "source": {"type": "string"},
          "url": {"type": "string", "format": "uri"},
          "quote": {"type": "string"}
        }
      }
    },
    "willingness_to_pay": {
      "type": "object",
      "required": ["signal", "confidence"],
      "properties": {
        "signal": {"type": "string"},
        "confidence": {"enum": ["low", "moderate", "high"]}
      }
    },
    "source_rights": {
      "type": "object",
      "required": ["public", "examples"],
      "properties": {
        "public": {"type": "boolean"},
        "examples": {"type": "array", "items": {"type": "string"}, "minItems": 1}
      }
    },
    "first_sale_path": {
      "type": "object",
      "required": ["channel", "angle"],
      "properties": {
        "channel": {"type": "string"},
        "angle": {"type": "string"}
      }
    },
    "rejection_reason": {"type": "string"}
  }
}
