{
  "version": 1,
  "type": "opportunity_brief",
  "slug": "fl-real-estate-agent-licenses",
  "created": "2026-05-06T13:00:00-04:00",
  "created_by": "opportunity-researcher",
  "status": "APPROVED",
  "score": 8,
  "summary": "A cleaned, downloadable CSV of all Florida-licensed real estate agents and brokers sourced from the Florida DBPR (Department of Business and Professional Regulation) public records system — a free, weekly-updated CSV with zero authentication required. DBPR exports 327,000+ active/inactive licensees including salesperson, broker, and broker-associate ranks, with license number, status, name, DBA, mailing address, county, original issue date, and expiration date. RealEstateAgentData.com and BookYourData both sell formatted versions of this same data at undisclosed but material prices, proving a strong buyer market. A one-time $39–$59 FL-only CSV targets the real estate SaaS SDR, mortgage lender, and proptech vendor who needs to reach Florida's 300K+ agents without paying for a national subscription database.",
  "audience": {
    "who": "Real estate SaaS vendors (CRM platforms: Follow Up Boss, Lofty, kvCORE, Sierra Interactive) whose SDRs cold-call brokerages and agents; mortgage lenders and loan officers sourcing referral partner lists; title insurance companies doing agent outreach; errors & omissions (E&O) insurance brokers; continuing education providers selling real estate CE credits; proptech companies selling transaction management, showing software, or e-signature tools to agents.",
    "where_found": [
      "https://www2.myfloridalicense.com/real-estate-commission/public-records/",
      "https://realestateagentdata.com/florida-realtors-email-list/",
      "https://www.bookyourdata.com/buy-email-list/florida-realtors-real-estate-agents"
    ]
  },
  "data_wanted": "License code, licensee name, DBA name, rank (Sales Associate, Broker, Broker Associate), mailing address (street, city, state, ZIP), county name, license number, primary status (Active, Inactive), original license date, expiration date — all sourced from DBPR weekly CSV download at myfloridalicense.com/real-estate-commission/public-records/, no authentication required.",
  "evidence": [
    {
      "source": "Florida DBPR Real Estate Commission — free weekly CSV download of all licensees, no login required, updated every week",
      "url": "https://www2.myfloridalicense.com/real-estate-commission/public-records/",
      "quote": "DBPR provides updated download files in CSV format on a weekly basis. The files contain Current, Active and Inactive licensees."
    },
    {
      "source": "RealEstateAgentData.com — sells a formatted FL real estate agent email list (327,644 records) at commercial pricing, proving strong buyer willingness to pay for the same DBPR-derived data",
      "url": "https://realestateagentdata.com/florida-realtors-email-list/",
      "quote": "Florida Realtors Email List 2026 | 327,644 Agents — commonly used by marketing agencies, SaaS and proptech companies, mortgage and insurance providers."
    },
    {
      "source": "BookYourData — sells a verified FL real estate agent email list (318,245 records) confirming multiple commercial vendors monetizing the same public data at premium pricing",
      "url": "https://www.bookyourdata.com/buy-email-list/florida-realtors-real-estate-agents",
      "quote": "Florida Real Estate Agents Email List - 318,245 Verified Realtors"
    },
    {
      "source": "USAgentLeads — offers verified real estate agent contact data per state at $49/state for 50-state coverage, proving the $39–$59 one-time price point is market-validated",
      "url": "https://www.usagentleads.com/states",
      "quote": "Agent Email Lists by State 2026 — All 50 States from $49"
    }
  ],
  "willingness_to_pay": {
    "signal": "At least three commercial vendors (RealEstateAgentData.com, BookYourData, USAgentLeads) package and sell this same DBPR-derived dataset at prices ranging from $49/state upward. Real estate SaaS SDRs at companies like Lofty, Follow Up Boss, and kvCORE actively need outreach lists of active agents and brokerages. A one-time $49 FL CSV is a no-brainer purchase compared to paying a national data subscription for 2M+ records when the buyer only needs FL.",
    "confidence": "high"
  },
  "source_rights": {
    "public": true,
    "examples": [
      "https://www2.myfloridalicense.com/real-estate-commission/public-records/",
      "https://www2.myfloridalicense.com/sto/file_download/extracts/REALESTATE2501LICENSE_1.csv",
      "https://www2.myfloridalicense.com/public-records-read-medisclaimer/"
    ]
  },
  "first_sale_path": {
    "channel": "Gumroad listing + Reddit r/realtors, r/RealEstate, r/SaaS (RE software vendors angle), LinkedIn targeting real estate SaaS SDRs, mortgage loan officers, and title company marketing teams",
    "angle": "\"Florida Licensed Real Estate Agents & Brokers — 2026 Database, 300,000+ Records, CSV\" — license type, active status, name, address, county, license #, expiration date. Positioned against $49+ state-slice competitors: 'Same DBPR data. $39. No subscription. Every active FL agent and broker in one clean CSV, ready to import into Salesforce or HubSpot.' FL is the largest single-state market for real estate activity and SaaS vendor SDR lists."
  }
}
