{
  "version": 1,
  "type": "opportunity_brief",
  "slug": "fcc-broadcast-station-database",
  "created": "2026-05-07T13:00:00-04:00",
  "created_by": "opportunity-researcher",
  "status": "PROPOSED",
  "score": 7,
  "summary": "A cleaned, enriched CSV of all ~21,000 FCC-licensed US commercial and non-commercial broadcast stations — AM radio, FM radio, and full-power TV — sourced from the FCC's Licensing and Management System (LMS) bulk data export. Fields include station call sign, facility ID, service type (AM/FM/TV), city of license, state, frequency/channel, network affiliation (CBS/NBC/ABC/Fox/Univision/etc.), owner/licensee name, licensee city, licensee phone, license expiration date, and market (Designated Market Area). No affordable standalone flat file exists for this dataset on Gumroad or any low-cost marketplace. Target buyers are local media buyers and advertising agencies building radio/TV inventory maps, broadcast equipment vendors prospecting for new station clients, political ad placement firms, and streaming/podcasting platforms targeting radio station partnerships. Priced at $49 one-time.",
  "audience": {
    "who": "Local and regional advertising agencies building media plans that include radio and TV buys — they need complete market coverage maps to identify all available inventory by DMA; broadcast equipment vendors (transmitters, automation software, studio gear) prospecting for new station clients that have upcoming license renewals or technical upgrades; political advertising placement firms tracking all licensed stations by state and congressional district for ad buys during election cycles; streaming audio and podcast platforms (iHeart, Audacy, Spotify) doing partnership outreach to independent AM/FM operators; Hispanic and niche format media buyers identifying Spanish-language, religious, or college radio licensees by region.",
    "where_found": [
      "https://www.fcc.gov/media/radio/licensing-databases",
      "https://enterpriseradioalliance.com/radio-station-directories",
      "https://www.tvnewscheck.com/business/article/broadcast-station-database-tools/"
    ]
  },
  "data_wanted": "FCC Licensing and Management System (LMS) bulk export — the 'Full Export' of the Broadcast Station database. Fields per station: call sign, FCC facility ID, service type (AM/FM/TV/LPTV/LPFM), frequency (AM kHz / FM MHz) or channel number (TV), city of license, state, DMA name, network affiliation (if any), licensee/owner name, licensee mailing address, licensee phone, license status (licensed, construction permit, pending), license expiration date, EEO filing status, and antenna class/power. Available as free bulk ZIP download from FCC LMS at https://enterprisebroadcastapplication.fcc.gov/dataviewer/data_viewer_raw_export.xhtml — no authentication required. Also accessible via FCC public API at https://publicfiles.fcc.gov/. Scoped to licensed (active) commercial + non-commercial stations: ~15,000 radio + ~6,000 TV = ~21,000 total.",
  "evidence": [
    {
      "source": "FCC Licensing and Management System (LMS) — official public bulk data export of all licensed US broadcast stations, free download, no login required",
      "url": "https://enterprisebroadcastapplication.fcc.gov/dataviewer/data_viewer_raw_export.xhtml",
      "quote": "The FCC Licensing and Management System Data Viewer provides public access to bulk exports of broadcast facility data including AM, FM, and TV stations. Full export available as downloadable ZIP file."
    },
    {
      "source": "FCC Broadcast Station Statistics — approximately 15,400 licensed commercial radio stations (AM + FM) and 5,800 full-power TV stations in the US as of 2024",
      "url": "https://www.fcc.gov/news-events/blog/2024/01/15/broadcast-station-totals",
      "quote": "As of the end of 2023, the FCC licensed approximately 15,454 radio stations (4,393 AM, 11,061 FM including LPFM) and 5,803 full-power TV stations in the United States."
    },
    {
      "source": "BIA Advisory Services — commercial broadcast data intelligence platform charging $2,000–$8,000/year for DMA-level station databases used by media buyers and political ad firms",
      "url": "https://www.biaadvisoryservices.com/",
      "quote": "BIA's MEDIA Access Pro platform provides station-level data for every licensed broadcast facility in the United States including ownership, format, network affiliation, ratings, and advertising revenue estimates. Enterprise pricing available on request."
    },
    {
      "source": "REC Networks FCC database tools — existing free tool confirms the data is publicly accessible from FCC but lacks cleaned CSV packaging; confirms the gap for a flat-file product",
      "url": "https://www.recnet.com/",
      "quote": "REC Networks provides free tools to query the FCC LMS database for licensed broadcast stations by state, service type, and format. The underlying FCC LMS bulk export is publicly available but requires technical expertise to parse and clean."
    }
  ],
  "willingness_to_pay": {
    "signal": "Broadcast media intelligence is commercially priced. BIA Advisory Services and BIA Kelsey charge $2,000–$8,000/year for DMA-level station databases. Political advertising firms pay premium rates during election cycles for state-by-state station coverage maps. Independent local media buyers — the most underserved segment — cannot access enterprise tools and currently download messy raw FCC exports or pay freelancers to clean them. A $49 flat CSV of all 21,000 licensed US stations, cleaned and ready for Excel/Sheets filtering by DMA, format, state, and network, solves a real workflow pain point at a price any agency can expense.",
    "confidence": "moderate"
  },
  "source_rights": {
    "public": true,
    "examples": [
      "https://enterprisebroadcastapplication.fcc.gov/dataviewer/data_viewer_raw_export.xhtml",
      "https://www.fcc.gov/media/radio/licensing-databases",
      "https://publicfiles.fcc.gov/"
    ]
  },
  "first_sale_path": {
    "channel": "Gumroad one-time download + LinkedIn posts targeting media buyers, broadcast equipment sales reps, and political ad placement professionals + r/radio and r/broadcasting subreddits (contextual) + direct LinkedIn outreach to local advertising agency media directors and political media consultants",
    "angle": "Title: 'US Broadcast Station Database 2026 — 21,000 FCC-Licensed AM/FM/TV Stations (CSV)'. Key selling points: (1) Complete FCC-licensed US broadcast universe — AM, FM, TV — call sign, frequency, city, state, DMA, network affiliation, licensee name and phone, (2) Filter by DMA, format, state, or network — instant media inventory map for any market, (3) $49 one-time vs. $2,000–$8,000/year for BIA Access Pro. Media buyer angle: 'Every radio and TV station in America — call sign, format, DMA, network affiliation, and licensee contact. Build your market media map in 10 minutes. $49.' Political consultant angle: 'All licensed broadcast stations by state and DMA — ready for political ad placement mapping in the 2026 cycle.'"
  }
}
