{
  "version": 1,
  "type": "opportunity_brief",
  "slug": "cms-medicare-home-health-agencies",
  "created": "2026-05-05T13:00:00-04:00",
  "created_by": "opportunity-researcher",
  "status": "APPROVED",
  "score": 8,
  "summary": "A cleaned, downloadable CSV of all Medicare-certified home health agencies sourced from CMS data.cms.gov \u2014 a fully public, no-auth dataset updated monthly. CMS publishes ~11,400 agency records including agency name, address, phone, CMS certification number, ownership type (for-profit/non-profit/government), and quality star ratings. CarePrecise charges $859\u2013$4,795/year for a 9M+ provider database built from the same CMS sources; Ampliz charges $50/month. A one-time affordable CSV targeted at medical SaaS vendors who need exactly this vertical \u2014 not a massive multi-specialty database \u2014 undercuts every subscription by an order of magnitude.",
  "audience": {
    "who": "Medical SaaS vendors selling CRM, scheduling, EVV (electronic visit verification), billing, and payroll tools to home health agencies; medical equipment and supply reps (wound care, durable medical equipment); healthcare staffing agencies recruiting home health aides; and healthcare insurance brokers selling liability and workers comp to home health operators.",
    "where_found": [
      "https://data.cms.gov/provider-data/dataset/6jpm-sxkc",
      "https://www.careprecise.com/marketing-to-healthcare-providers.htm",
      "https://prospeo.io/s/b2b-data-provider-healthcare"
    ]
  },
  "data_wanted": "Agency name, doing-business-as name, CMS certification number, address (street, city, state, ZIP), phone number, ownership type (for-profit/non-profit/government), agency type (home health/hospice), Medicare participation status, overall quality star rating, date of most recent inspection \u2014 all sourced from CMS Provider Data Catalog (data.cms.gov), no authentication required.",
  "evidence": [
    {
      "source": "CMS Provider Data Catalog \u2014 Home Health Care Agencies public dataset, no login required, CSV download available",
      "url": "https://data.cms.gov/provider-data/dataset/6jpm-sxkc",
      "quote": "Home Health Care - National Data. Downloadable data file with information about home health agencies that participate in Medicare, including overall quality ratings."
    },
    {
      "source": "CarePrecise \u2014 charges $859 (single download) to $4,795/year for a 9M+ provider database built from the same NPPES, PECOS, and CMS public sources, proving strong buyer willingness to pay for formatted government health provider data",
      "url": "https://www.careprecise.com/marketing-to-healthcare-providers.htm",
      "quote": "CarePrecise delivers 9M+ provider records as a Microsoft Access database with unlimited exports. Pricing starts at $859 for Gold (single download) and $999 for Platinum, with annual subscriptions with monthly updates running up to $4,795/year."
    },
    {
      "source": "Ampliz \u2014 healthcare B2B database charges $50/month for health provider access, proving recurring buyer demand",
      "url": "https://www.ampliz.com/resources/healthcare-database-provider/",
      "quote": "Ampliz offers a budget healthcare database option at $50/month with healthcare-specific filters."
    },
    {
      "source": "Prospeo \u2014 2026 roundup of best B2B data providers for healthcare confirms sustained market for healthcare provider lists",
      "url": "https://prospeo.io/s/b2b-data-provider-healthcare",
      "quote": "Best B2B Data Providers for Healthcare in 2026"
    }
  ],
  "willingness_to_pay": {
    "signal": "CarePrecise's $859 single-download and $4,795/year subscription \u2014 built from the same CMS data \u2014 proves buyers pay hundreds to thousands of dollars for formatted healthcare provider lists. A one-time $49\u2013$79 CSV of just home health agencies (not 9M records buyers don't need) is a no-brainer purchase for any medical SaaS SDR or equipment rep who needs to reach this specific vertical without paying for an enterprise data subscription.",
    "confidence": "high"
  },
  "source_rights": {
    "public": true,
    "examples": [
      "https://data.cms.gov/provider-data/dataset/6jpm-sxkc",
      "https://data.cms.gov/provider-data/topics/home-health-services",
      "https://data.cms.gov/provider-characteristics/hospitals-and-other-facilities/home-health-agency-all-owners"
    ]
  },
  "first_sale_path": {
    "channel": "Gumroad listing + Reddit r/homehealth, r/HealthIT, r/SaaS (for software vendors), LinkedIn outreach to medical SaaS SDRs and BDRs",
    "angle": "\"11,400 Medicare-Certified Home Health Agencies \u2014 US Database 2026, CSV\" \u2014 ownership type, phone, address, quality star rating, ready to import into Salesforce or HubSpot. Positioned against CarePrecise's $859 database: 'You don't need 9 million provider records. You need 11,000 home health agencies. Here they are. One payment. Done.'"
  }
}